{
  "manifest_id": "rights-three-cells-huginn-001",
  "world_namespace": "earth2",
  "created_at": "2026-09-04T21:30:00Z",
  "items": [
    {
      "item_id": "fixture-map-001",
      "source_uri": "urn:agentic-blender:fixture:minimal-world",
      "rights_holder": "TO BE CONFIRMED BY PROJECT OWNER",
      "license_expression": "NOASSERTION",
      "attribution": "Agentic Blender research fixture",
      "permissions": {
        "use": true,
        "modify": true,
        "public_distribution": false,
        "commercial_use": false,
        "machine_learning": false
      },
      "territories": [],
      "embargo_until": null,
      "human_verified": false,
      "verified_by": null,
      "verified_at": null,
      "notes": "Deliberately blocked from public dispatch until a human selects and verifies a licence."
    },
    {
      "item_id": "huginn-charge-cc-by",
      "source_uri": "https://studio.blender.org/characters/huginn/v2/",
      "rights_holder": "Blender Foundation | studio.blender.org (Charge, 2022)",
      "license_expression": "CC-BY-4.0",
      "attribution": "Huginn Rig (CC-BY) Blender Foundation | studio.blender.org",
      "permissions": {
        "use": true,
        "modify": true,
        "public_distribution": true,
        "commercial_use": true,
        "machine_learning": false
      },
      "territories": [],
      "embargo_until": null,
      "human_verified": false,
      "verified_by": null,
      "verified_at": null,
      "notes": "CC BY 4.0 per the Blender Studio character page and the parent site's Open Movie Licences; the one obligation is attribution. human_verified stays false until David ticks it, so the capsule stays private. The file references a Charge production plate that is not in the free download; the compiler replaces it with neutral grey."
    }
  ]
}